{
  "$schema": "https://json-schema.org/draft/2020-12/schema",
  "$id": "https://example.com/schemas/workpackage.v1.json",
  "title": "Workpackage",
  "type": "object",
  "additionalProperties": true,
  "required": ["version", "number", "slug", "title", "status", "createdAt", "updatedAt"],
  "properties": {
    "version": { "type": "string", "const": "1" },
    "number": { "type": "integer", "minimum": 1 },
    "slug": { "type": "string", "pattern": "^[a-z0-9]+(?:-[a-z0-9]+)*$" },
    "title": { "type": "string", "minLength": 1 },
    "summary": { "type": "string" },
    "status": {
      "type": "string",
      "enum": ["draft", "active", "blocked", "done", "dropped"]
    },
    "createdAt": { "type": "string", "format": "date-time" },
    "updatedAt": { "type": "string", "format": "date-time" },
    "owner": { "type": "string" },
    "tags": { "type": "array", "items": { "type": "string" } },
    "links": { "type": "array", "items": { "type": "string" } },
    "context": { "type": "object", "additionalProperties": true }
  }
}
