{
  "version": "1",
  "number": 1,
  "slug": "hardening-workpackage-operations",
  "title": "Hardening workpackage operations",
  "summary": "Add atomic writes, locking, validation, and ergonomic commands for agents.",
  "status": "done",
  "createdAt": "2025-10-20T01:35:32.489Z",
  "updatedAt": "2025-10-20T01:43:03.792Z",
  "owner": "jkropp",
  "tags": [],
  "links": [],
  "context": {}
}
