{
  "version": "1",
  "number": 12,
  "slug": "docs-parity-for-job-artifact-hooks",
  "title": "Docs parity for job artifact & hooks",
  "summary": "Implement documented job artifact schema, hook lifecycle, and related behaviors.",
  "status": "active",
  "createdAt": "2025-11-03T15:55:00.815Z",
  "updatedAt": "2025-11-03T18:45:00.000Z",
  "owner": "unknown",
  "tags": [],
  "links": [],
  "context": {}
}
