{
  "version": "1",
  "number": 14,
  "slug": "docs-code-parity-job-runtime",
  "title": "Docs/code parity: job runtime",
  "summary": "Implement the job orchestration + config dependency features promised in dev docs (queueing, requirements install, activation hooks) and adjust docs/tests accordingly.",
  "status": "draft",
  "createdAt": "2025-11-03T19:59:46.296Z",
  "updatedAt": "2025-11-03T19:59:46.296Z",
  "owner": "jkropp",
  "tags": [],
  "links": [],
  "context": {}
}
