{
  "version": "1",
  "number": 8,
  "slug": "port-ade-backend-features",
  "title": "Port ADE backend features",
  "summary": "Incrementally migrate required backend capabilities from .old-codebase/ade into backend/app following backend/docs/backend_porting_guardrails.md.",
  "status": "active",
  "createdAt": "2025-10-20T03:14:38.973Z",
  "updatedAt": "2025-10-20T03:14:44.335Z",
  "owner": "jkropp",
  "tags": [],
  "links": [],
  "context": {}
}
