{
  "version": "1",
  "number": 2,
  "slug": "backend-feature-first-refactor",
  "title": "Backend feature-first refactor",
  "summary": "Convert FastAPI backend folders to by-feature structure.",
  "status": "done",
  "createdAt": "2025-10-20T01:48:45.677Z",
  "updatedAt": "2025-10-20T02:18:46.032Z",
  "owner": "jkropp",
  "tags": [],
  "links": [],
  "context": {}
}
