{
  "version": "1",
  "number": 13,
  "slug": "ade-safe-mode-skip-config-execution",
  "title": "ADE Safe Mode (Skip Config Execution)",
  "summary": "Add ADE_SAFE_MODE backend flag, health surface, job/orchestrator guards, and frontend banner.",
  "status": "active",
  "createdAt": "2025-11-03T19:50:53.632Z",
  "updatedAt": "2025-11-03T19:51:05.580Z",
  "owner": "jkropp",
  "tags": [],
  "links": [],
  "context": {}
}
