{
  "version": "1",
  "number": 10,
  "slug": "harden-session-cookie-secure-detection",
  "title": "Harden session cookie secure detection",
  "summary": "Ensure session cookies are always issued with Secure flag despite spoofed X-Forwarded-Proto headers.",
  "status": "done",
  "createdAt": "2025-10-22T04:50:21.161Z",
  "updatedAt": "2025-10-22T05:01:06.483Z",
  "owner": "jkropp",
  "tags": [],
  "links": [],
  "context": {}
}
