{
  "version": "1",
  "number": 9,
  "slug": "fix-document-download-header-injection",
  "title": "Fix document download header injection",
  "summary": "Prevent response header injection via malicious document filenames.",
  "status": "done",
  "createdAt": "2025-10-22T04:50:01.152Z",
  "updatedAt": "2025-10-22T05:00:59.737Z",
  "owner": "jkropp",
  "tags": [],
  "links": [],
  "context": {}
}
