{
  "version": "1",
  "number": 5,
  "slug": "split-dev-scripts",
  "title": "Split dev scripts",
  "summary": "Add dev:backend and dev:frontend and update dev aggregator",
  "status": "done",
  "createdAt": "2025-10-20T02:24:28.968Z",
  "updatedAt": "2025-10-20T02:29:20.005Z",
  "owner": "jkropp",
  "tags": [],
  "links": [],
  "context": {}
}
